<?xml version="1.0" encoding="UTF-8"?>
<config xmlns="experimentconfig" xmlns:xsi="http://www.w3.org/2001/XMLSchema-instance" xsi:schemaLocation="experimentconfig experimentconfig.xsd">
<loader name="ARFFFolderLoader" datalocation="exp-JAVAPROCESS/data" relative="false"/>
<versionfilter name="MinClassNumberFilter" param="5" />
<setwisepreprocessor name="Normalization" param=""/>
<postprocessor name="Undersampling" param="" />
<trainer name="WekaTraining" param="SMORBF weka.classifiers.functions.SMO -K weka.classifiers.functions.supportVector.RBFKernel" />
<trainer name="WekaLocalEMTraining" param="SMORBFLocalEM weka.classifiers.functions.SMO -K weka.classifiers.functions.supportVector.RBFKernel" />
<trainer name="WekaLocalFQTraining" param="SMORBFLocalFQ weka.classifiers.functions.SMO -K weka.classifiers.functions.supportVector.RBFKernel" />
<resultspath path="exp-JAVAPROCESS/results"/>
<eval name="NormalWekaEvaluation" param="" />
</config>